{
  "$schema": "./handoff.schema.json",
  "schemaVersion": 1,
  "project": {
    "name": "SullyOS Xiafork",
    "repository": "ChituQAQ/sullyos-caleb-fork",
    "kind": "long-term upstream-compatible fork"
  },
  "generatedAt": "2026-08-09T16:05:19.835Z",
  "git": {
    "canonicalBranch": "master",
    "refreshBranch": "feat/w3-p0-external-stall-supervisor",
    "headAtRefresh": "5c7cd613afc5721345d877c1262d0822db079613",
    "originMasterAtRefresh": "5c7cd613afc5721345d877c1262d0822db079613",
    "upstreamMaster": "44bdf88dc35eb2f5edee9ce56b92716a3fca76df",
    "workingTreeCleanAtRefresh": false,
    "expectedCleanAfterCommit": true,
    "handoffCommit": {
      "resolution": "single-focused-descendant",
      "baseCommit": "5c7cd613afc5721345d877c1262d0822db079613",
      "commitsAhead": 1,
      "subject": "feat: add external stall supervisor mvp",
      "allowedPaths": [
        ".gitignore",
        "AGENTS.md",
        ".xiafork/README.md",
        ".xiafork/handoff.json",
        "scripts/xiafork-handoff.test.ts",
        "scripts/xiafork-run-state.mjs",
        "scripts/xiafork-supervisor.mjs",
        "scripts/xiafork-supervisor.test.ts"
      ]
    }
  },
  "productRoadmap": {
    "currentMilestone": "M1",
    "milestoneStatus": "in_progress_external",
    "completed": [
      "M0"
    ],
    "preparedAhead": [
      {
        "id": "M3-P0",
        "status": "preparation_complete",
        "summary": "Backup compatibility test plan",
        "commit": "cd9b370d40cf23803b9974dbb72a1083f2664573"
      },
      {
        "id": "M3-P1",
        "status": "preparation_complete",
        "summary": "Non-destructive backup compatibility scaffolding",
        "commit": "ac3834c96bcdc90b48451a7fdf0c704eb3a31ae5"
      }
    ],
    "blockedBy": [
      "The M1 local TTS A/B result is not available in this repository."
    ],
    "milestones": [
      {
        "id": "M0",
        "status": "complete",
        "summary": "Official development baseline"
      },
      {
        "id": "M1",
        "status": "in_progress_external",
        "summary": "Local TTS A/B evaluation"
      },
      {
        "id": "M2",
        "status": "blocked",
        "summary": "Unified local TTS provider abstraction"
      },
      {
        "id": "M3",
        "status": "not_started",
        "summary": "Official backup bidirectional compatibility"
      },
      {
        "id": "M4",
        "status": "not_started",
        "summary": "Local music together-listening MVP"
      },
      {
        "id": "M5",
        "status": "not_started",
        "summary": "Work Mode Lite with memory isolation"
      },
      {
        "id": "M6",
        "status": "not_started",
        "summary": "Project/tool bridge capability"
      },
      {
        "id": "M7",
        "status": "not_started",
        "summary": "Desktop layout for selected high-frequency pages"
      },
      {
        "id": "M8",
        "status": "not_started",
        "summary": "Deeper cross-device capability using existing official infrastructure first"
      },
      {
        "id": "M9",
        "status": "not_started",
        "summary": "Central server or realtime capability only if later proven necessary"
      }
    ]
  },
  "workflowRoadmap": {
    "currentMilestone": "W3",
    "milestoneStatus": "in_progress",
    "completed": [
      "W0",
      "W2"
    ],
    "next": "W3",
    "milestones": [
      {
        "id": "W0",
        "status": "complete",
        "summary": "Git Handoff"
      },
      {
        "id": "W1",
        "status": "established",
        "summary": "Autonomous Execution / AUTOPILOT, including AUTOPILOT_STALL_WATCHDOG"
      },
      {
        "id": "W2",
        "status": "complete",
        "summary": "Structured Repository Handoff"
      },
      {
        "id": "W3",
        "status": "in_progress",
        "summary": "P0 external stall supervisor implemented; P1 guarded automatic takeover remains future"
      }
    ]
  },
  "lastCompletedWork": [
    {
      "id": "W3-P0",
      "status": "implemented",
      "summary": "External deterministic stall watcher, durable execution checkpoint, lease foundation, recovery bundle, and read-only Supervisor Codex adapter"
    },
    {
      "id": "M3-P1",
      "summary": "Non-destructive backup compatibility scaffolding",
      "commits": [
        {
          "sha": "ac3834c96bcdc90b48451a7fdf0c704eb3a31ae5",
          "subject": "test: add backup compatibility scaffolding"
        }
      ]
    },
    {
      "id": "M3-P0",
      "summary": "Backup compatibility test plan",
      "commits": [
        {
          "sha": "cd9b370d40cf23803b9974dbb72a1083f2664573",
          "subject": "docs: define backup compatibility test plan"
        }
      ]
    }
  ],
  "tests": [
    {
      "command": ".\\node_modules\\.bin\\vitest.cmd run utils/backupCompatibility.scaffolding.test.ts",
      "result": "pass",
      "files": 1,
      "cases": 7
    },
    {
      "command": ".\\node_modules\\.bin\\vitest.cmd run utils/backupCompatibility.scaffolding.test.ts utils/backupFormat.test.ts utils/backupImportPolicy.test.ts utils/db.test.ts utils/backupIntegrity.test.ts",
      "result": "pass",
      "files": 5,
      "cases": 48
    },
    {
      "command": ".\\node_modules\\.bin\\vitest.cmd run scripts/xiafork-handoff.test.ts",
      "result": "pass",
      "files": 1,
      "cases": 8
    },
    {
      "command": ".\\node_modules\\.bin\\vitest.cmd run scripts/xiafork-supervisor.test.ts",
      "result": "pass",
      "files": 1,
      "cases": 10
    }
  ],
  "externalWork": [
    {
      "id": "M1-TTS-AB",
      "status": "in_progress_external",
      "summary": "Local TTS A/B evaluation is running outside the SullyOS repository; its result is unavailable to this repository handoff.",
      "repositoryResultAvailable": false
    }
  ],
  "blockers": [
    "The M1 TTS A/B winner is unavailable to the repository handoff.",
    "M2 must not start until an explicit handoff records the selected TTS adapter target."
  ],
  "nextAllowedWork": [
    "Wait for an explicit repository handoff containing the M1 TTS winner before starting M2.",
    "Safe repository preparation may continue only when separately authorized.",
    "W3-P0 maintenance may continue only when separately authorized; W3-P1 guarded automatic takeover remains FUTURE and requires explicit authorization."
  ],
  "hardStops": [
    "Git state conflicts with this handoff or contains unexplained work.",
    "Origin master contains an unknown concurrent update.",
    "Continuation would require force, rebase, a non-fast-forward merge, or history rewriting.",
    "Product work requires the unavailable M1 TTS winner.",
    "Continuation would exceed the W3-P0 read-only recovery boundary, implement W3-P1 automatic takeover, or start unapproved product work."
  ],
  "notes": [
    "Git status and commit history are authoritative; this handoff is navigation metadata.",
    "M3-P0 and M3-P1 are preparatory work only and do not mean M3 production is complete.",
    "No SullyOS runtime success is asserted for the external TTS evaluation.",
    "W1 includes AUTOPILOT_STALL_WATCHDOG: 15 minutes without observable progress triggers a read-only self-check, not a task timeout.",
    "The watchdog must classify the state as ACTIVE, AGENT_STALL, or PROCESS_STALL and continue or safe-stop without blind reset-and-retry behavior.",
    "Known W1 limitation: a worker already stuck in an agent-side stall may be unable to invoke its own self-watchdog; the stalled Agent must never be the sole owner of stall detection and recovery.",
    "W3-P0 implements an external deterministic watcher with an execution lifecycle independent of the worker and separates Agent liveness from task or child-process liveness using observable progress signals.",
    "W3-P0 stores durable run checkpoints, leases, observable evidence, and recovery bundles only under Git-ignored .xiafork/runtime/; these files must not contain chat transcripts, secrets, credentials, or tokens.",
    "W3-P0 uses a minimum single-owner lease that rejects silent owner replacement; it does not steal leases or start replacement Agents.",
    "On AGENT_STALL, W3-P0 may invoke a short-lived Supervisor Codex through the supported non-interactive CLI in an ephemeral read-only sandbox; the deterministic watcher owns timing.",
    "The harmless local demo generated a recovery bundle and launched Codex 0.147.0 with approval=never and sandbox=read-only; the assessment could not complete because the current execution policy blocked outbound API access, and that boundary was not bypassed.",
    "W3 takeover must inherit the original authorized scope, hard stops, forbidden paths, human-only boundaries, and safety constraints; replacement never expands authority.",
    "W3-P0 is implemented but full W3 is not complete; W3-P1 automatic replacement and takeover remains FUTURE and is not authorized."
  ]
}
